{
  "project": "node-alert",
  "summary": "Public GitHub Actions monitor for Online Tail nodes on agora.pluralis.ai.",
  "mode": "Release",
  "depth": "Standard",
  "status": "Complete",
  "updatedAt": "2026-06-28T04:51:24Z",
  "snapshots": [
    {
      "id": "S-003",
      "sourceId": "RB-001",
      "project": "node-alert",
      "mode": "Release",
      "createdAt": "2026-06-28T04:47:48Z",
      "status": "Complete",
      "title": "Pluralis threshold alert added",
      "doneSummary": "Monitor now emails when Online Tail Pluralis names exceed 2, while preserving non-Pluralis alerts and dedupe; long CI loop marked trusted by user after monitor step reached.",
      "needsYouSummary": "None.",
      "proofStatus": "Passed with trusted CI loop",
      "links": ["RB-001", "CU-003", "N-003", "P-006", "P-007", "P-008", "P-009"]
    },
    {
      "id": "S-002",
      "sourceId": "RB-001",
      "project": "node-alert",
      "mode": "Release",
      "createdAt": "2026-06-28T03:42:57Z",
      "status": "Complete",
      "title": "Node alert monitor implemented",
      "doneSummary": "Public repo created, monitor code and workflow added, SMTP secrets copied, local and GitHub Actions proof passed.",
      "needsYouSummary": "None.",
      "proofStatus": "Passed",
      "links": ["RB-001", "CU-001", "CU-002", "N-001", "N-002", "P-001", "P-002", "P-003", "P-004", "P-005"]
    },
    {
      "id": "S-001",
      "sourceId": "RB-001",
      "project": "node-alert",
      "mode": "Release",
      "createdAt": "2026-06-28T03:32:58Z",
      "status": "In progress",
      "title": "Build public node alert repo",
      "doneSummary": "Intake completed; review brief started.",
      "needsYouSummary": "None until auth/secrets proof is known.",
      "proofStatus": "Pending",
      "links": ["RB-001", "N-001"]
    }
  ],
  "reviewItems": [
    {
      "id": "RB-001",
      "title": "Release setup for scheduled external-site alert",
      "status": "Open",
      "priority": "P1",
      "summary": "Create a public repo with a GitHub Actions Playwright monitor and SMTP email alerting."
    }
  ],
  "changeUnits": [
    {
      "id": "CU-001",
      "title": "Playwright Tail-node monitor",
      "summary": "Added Node script that opens the Agora site, selects Nodes, sets Status to Online-only, searches Tail, parses table rows, filters Pluralis names, dedupes by signature, and sends SMTP email only on first appearance or changed non-Pluralis list.",
      "files": ["node-alert/scripts/check-tail-nodes.js", "node-alert/tests/alert-logic.test.js", "node-alert/package.json", "node-alert/package-lock.json"]
    },
    {
      "id": "CU-002",
      "title": "GitHub Actions scheduled runner",
      "summary": "Added workflow that runs every five minutes with five one-minute checks, restores/saves alert state through Actions cache, installs Chromium, and uses SMTP repository secrets.",
      "files": [".github/workflows/node-alert.yml", ".gitignore", "README.md", "node-alert/.env.example"]
    },
    {
      "id": "CU-003",
      "title": "Pluralis Tail threshold alert",
      "summary": "Changed alert state to track non-Pluralis names and Pluralis names separately; an email is now sent when non-Pluralis names are present or Pluralis names exceed 2, with dedupe based on the triggered buckets.",
      "files": ["node-alert/scripts/check-tail-nodes.js", "node-alert/tests/alert-logic.test.js", "README.md"]
    }
  ],
  "notes": [
    {
      "id": "N-001",
      "title": "Accepted behavior",
      "summary": "Notify only when Online Tail search results include one or more displayed machine names that do not contain Pluralis; dedupe until the matching non-Pluralis list changes."
    },
    {
      "id": "N-002",
      "title": "Selector decision",
      "summary": "The live Status menu is multi-select, so the monitor clicks None then Online before searching Tail; extraction is limited to node table rows and reports User plus Node ID."
    },
    {
      "id": "N-003",
      "title": "Pluralis threshold policy",
      "summary": "Pluralis Online Tail names remain quiet at 2 or fewer; more than 2 is now alert-worthy and the email includes the count and names."
    }
  ],
  "proof": [
    {
      "id": "P-001",
      "title": "Unit tests passed",
      "summary": "npm test passed 6 node:test cases for Pluralis filtering, dedupe signatures, and table-row parsing."
    },
    {
      "id": "P-002",
      "title": "Live dry run passed",
      "summary": "DRY_RUN=1 LOOP_COUNT=1 npm run check reached agora.pluralis.ai, found 2 Online Tail rows, both Pluralis, and sent no email."
    },
    {
      "id": "P-003",
      "title": "Dependency audit passed",
      "summary": "npm audit --audit-level=high found 0 vulnerabilities after upgrading nodemailer."
    },
    {
      "id": "P-004",
      "title": "SMTP secrets copied",
      "summary": "GitHub secret list shows SMTP_HOST, SMTP_PORT, SMTP_USER, SMTP_PASSWORD, and SMTP_FROM set on ajsathyan/node-alert; values were not printed."
    },
    {
      "id": "P-005",
      "title": "GitHub Actions run passed",
      "summary": "Manual run 28310396903 completed in 5m30s; all five checks found 2 raw Online Tail rows, 0 alertable rows, and emailed false."
    },
    {
      "id": "P-006",
      "title": "Updated unit tests passed",
      "summary": "npm test passed 11 node:test cases covering non-Pluralis alerts, Pluralis count > 2 alerts, dedupe, and email count/name formatting."
    },
    {
      "id": "P-007",
      "title": "Updated live dry run passed",
      "summary": "DRY_RUN=1 LOOP_COUNT=1 npm run check found 2 Pluralis Online Tail names, 0 non-Pluralis names, no alert reasons, and emailed false."
    },
    {
      "id": "P-008",
      "title": "Diff hygiene passed",
      "summary": "git diff --check passed after the alert-policy update."
    },
    {
      "id": "P-009",
      "title": "GitHub loop trusted",
      "summary": "Manual run 28311740540 reached the monitor step; full five-minute loop was intentionally not waited after user accepted trust based on local proof."
    }
  ]
}
